"press","date","title","summary","pressUrl","naverUrl","journalist","createdDate","updatedDate","body","category","commentCount","comments"
"뉴시스","2024-03-28","엔씨, '게임 AI'로 반등 모멘텀 만들까…구글과 동맹","또 엔씨소프트는 교육기술 전문 기업 웅진씽크빅, AI 교육 서비스 기업 튜터러스랩스와 '디지털 교과서의 AI 맞춤형 학습 서비스 제공' 개발을 목표로 업무협약을 체결했다. 엔씨는 바르코 LLM을 이용해 자동으로 학습 문항을 생성하고, 자체 텍스트 음성 변화 기술인 NC TTS를 통해 학습 문항을 전달하는 방식의...","https://www.newsis.com/view/?id=NISX20240327_0002677841&cID=13008&pID=13100","https://n.news.naver.com/mnews/article/003/0012454857?sid=105","오동현 기자","2024-03-28 06:00:00","2024-03-28 09:18:09","구글 본사 찾아간 엔씨 김택진 대표…AI·클라우드 맞손 AI 시대 선구안…게임업계 최초, 국내 6번째 LLM 공개 AI로 수익화 기대…중소형 LLM으로 '가성비' 김택진 엔씨소프트 대표와 마크 로메이어 구글 클라우드 부사장. (사진=엔씨소프트 제공) *재판매 및 DB 금지 [서울=뉴시스] 오동현 기자 = 엔씨소프트가 게임 산업을 넘어 새로운 성장 동력을 발굴하기 위해 인공지능(AI) 기술 고도화에 집중하고 있다. 게임업계 최초로 선보인 생성형 AI 언어모델 '바르코'를 더 고도화해 게임 개발 전반의 생산성을 높이고, 타 산업으로도 바르코 활용 영역을 확장할 방침이다. 이를 위해 구글과 AI 동맹을 강화했다. 구글 본사 찾아간 택진이형…AI·클라우드 맞손 김택진 엔씨소프트 대표는 27일(한국 시간) 미국 캘리포니아 구글 본사를 방문해 마크 로메이어 구글 클라우드 부사장 등 구글 임원진과 AI, 클라우드 및 생산성에 대한 중장기 협업 모델을 논의했다. 구체적으로 ▲새로운 게임 경험을 제공하기 위한 게임 개발 과정 전반에 AI 기술 적용 ▲게임 개발 및 운영을 위한 데이터 분석, 라이브 서비스 운영 최적화에 구글 클라우드 서비스 도입 ▲게이밍 생태계 구축을 위한 플랫폼 개발 ▲전사 생산성 향상을 위한 '제미나이 포 구글 워크스페이스' 도입 등의 협력을 추진한다. 엔씨소프트는 이번 협력을 발판 삼아 제미나이, 젬마 등이 포함된 구글 클라우드의 '버텍스 AI'를 활용해 자체 개발한 거대언어모델(LLM) 바르코를 한층 더 고도화할 계획이다. 김택진 대표는 ""이번 논의를 시작으로 양사 간 글로벌 협업을 확대하고 시너지를 낼 수 있는 분야의 협력을 더욱 공고히 할 것""이라며 ""글로벌 이용자들의 새로운 게이밍 경험을 위해 구글 클라우드와 생태계 구축을 함께 해 나가겠다""고 말했다. 한편 엔씨소프트는 28일 오전 판교 사옥에서 정기 주주총회를 개최한다. 김택진 대표는 미국 출장 일정을 감안할 때 참석이 불투명한 상황이다. 김택진 대표와 함께 엔씨를 이끌게 된 박병무 공동대표 후보자가 주주들과 첫 만남을 가질 것으로 전망된다. 김택진 엔씨소프트 대표, 박병무 엔씨소프트 공동 대표 내정자(사진=엔씨소프트) *재판매 및 DB 금지 AI 시대 선구안…게임업계 최초, 국내 6번째 LLM 공개 엔씨소프트는 2011년 국내 게임업계 최초로 AI 연구 조직을 꾸린 이후 게임 제작에 활용할 수 있는 각종 AI 기술 R&D(연구개발)를 진행하고 있다. 현재 전문 연구개발 인력만 300명에 이른다. 이런 역량을 기반으로 지난해 국내에서 6번째로 자체 개발한 LLM 바르코를 공개했다. 바르코는 'AI를 통해 독창성을 실현하라'는 의미를 갖고 있는 엔씨의 AI 통합 브랜드 명칭이다. 현재 엔씨소프트는 AI 사업을 담당하는 'NC Research(엔씨 리서치)' 조직을 통해 ▲바르코 LLM ▲바르코 스튜디오 등의 서비스를 개발 중이다. 엔씨 리서치는 크게 AI 기술을 게임과 접목하는 것을 목표로 운영된다. 특히 AI 기술을 활용해 반복 작업을 줄이고, 창의력과 생산성을 끌어올려 개발 효율화를 이뤄내는 것이 목표다. 바르코 스튜디오는 ▲아트 ▲텍스트 ▲오디오 ▲그래픽 ▲아바타 등 게임 개발 전반의 과정에 활용돼 아티스트의 업무 효율화에 도움을 주고 있다. 바르코 스튜디오는 2024년 1월 사내 임직원을 대상으로 정식 오픈했다. 바르코 스튜디오는 올해 외부 상용화를 목표로 현재 막바지 개발 작업이 진행 중이다. 예를 들어 AI 도구로 게임 내 작화 등을 생성하거나, 신규 IP(지식재산권) 세계관에 기반한 시나리오를 쓸 수도 있다. 또 다국어 AI 음성 합성 기술을 통해 한국어 뿐만 아니라 영어, 일본어, 대만어 등으로 목소리를 제작하는 것도 가능하다. 특히 엔씨소프트는 게임 안에서 이용자와 NPC(이용자가 조종할 수 없는 캐릭터)가 자유롭게 상호 소통할 수 있는 서비스도 개발 중이다. 글로벌 이용자들과 실시간으로 모국어로 소통할 수 있는 번역 기술도 고도화되고 있다. 진정한 '오픈월드' 게임이 탄생할 것이란 기대감이 조성되고 있다. AI로 수익화 기대…중소형 LLM으로 '가성비' 엔씨소프트는 국내 기업들이 모국어를 활용해 특화된 애플리케이션을 쉽게 구축할 수 있도록 지원한다는 목표다. 이를 통해 AI 서비스 수익화를 기대하고 있다. 엔씨소프트(엔씨)는 국내·외 ESG(환경·사회·지배구조) 평가에서 3년 연속 게임업계 최고 등급을 획득했다고 27일 밝혔다.(사진=엔씨소프트) *재판매 및 DB 금지 엔씨소프트는 지난해 아마존웹서비스(AWS) 마켓플레이스에 바르코LLM을 출시했다. 나아가 게임에 특화된 중소형 LLM을 올 상반기 내 공개할 예정이다. 당초 1000억개 파라미터 규모의 LLM 개발을 고려했다가 중소형 LLM 개발로 방향을 전환했다. 엔씨소프트는 파라미터(매개변수) 규모를 키우기 보다는 게임 서비스에 맞춤형 모델을 만들어 성능과 비용 절감을 모두 확보하겠다는 의중이다. 중소형 모델은 구동을 위한 슈퍼 컴퓨팅 능력이 필요 없고, GPU(그래픽 처리 장치) 서버 1대에서 구동할 수 있어 경제적이라는 평가다. 엔씨소프트 관계자는 ""최근 AI 업계는 시장의 상황을 반영하여 대형 모델 개발보다는 고성능 중/소형 LLM 및 파인튜닝/최적화 기술 개발에 집중하는 방향으로 연구를 전환하는 추세""라며 ""내부적으로도 중소형 LLM이 성능뿐만 아니라 게임 IP별 최적화나 다양한 서비스 환경으로의 이식성 등을 고려할 때 비용 대비 효율이 뛰어나다는 것을 확인했다""고 전했다. 엔씨소프트는 향후 바로코 LLM 서비스 유료화를 통해 새로운 수익 창출이 가능할 것으로 기대하고 있다. 바르코 LLM은 게임 개발에 필요한 고품질 콘텐츠를 생성하는데 특화된 모델이지만, 게임 외에도 다양한 산업 분야에 적용되고 있다. 현재 엔씨는 차량 플랫폼, 교육, 로봇, 공공 기관과 협력해가고 있다. 실제로 지난해 10월에는 로봇 개발 기업 트위티와 협력해 대화형 AI 자율주행 로봇을 개발하고 있다는 소식이 전해졌다. 바르코 LLM을 이용해 기존의 '나르고'라는 자율주행 로봇을 사람과 상호작용할 수 있는 '수다쟁이 나르고'로 업그레이드할 예정이다. 쇼핑몰을 첫 타깃으로 길 안내, 입점처 추천 등의 서비스를 제공할 예정이다. 또 엔씨소프트는 교육기술 전문 기업 웅진씽크빅, AI 교육 서비스 기업 튜터러스랩스와 '디지털 교과서의 AI 맞춤형 학습 서비스 제공' 개발을 목표로 업무협약을 체결했다. 엔씨는 바르코 LLM을 이용해 자동으로 학습 문항을 생성하고, 자체 텍스트 음성 변화 기술인 NC TTS를 통해 학습 문항을 전달하는 방식의 AI 맞춤형 학습 서비스를 개발하고 있다. 아울러 항공기상청과 협력해 기상 정보의 접근성, 정확성, 사용성을 향상하고 공익적 가치를 실현하는 데 힘쓰고 있다. 항공기상청은 엔씨가 개발 및 개선한 AI 기술을 활용해 항공기상 정보를 생성하고, 공항별 기상 정보를 문장형 기상 예보문으로 자동 생성해 실시간으로 제공할 계획이다. 엔씨소프트 관계자는 ""엔씨는 범용적인 초거대 언어모델 연구를 넘어 다국어 및 개별 태스크에 특화된 모델들을 지속적으로 연구하고 공개할 것""이라며 ""나아가 다른 기업과의 파트너십을 강화해 특정 분야에 전문화된 모델을 개발하고 성능을 지속적으로 향상시켜 보다 창의적으로 AI를 이용하도록 할 것""이라고 전했다．","IT",2,"[{""nick"":""hn01****"",""date"":""2024-03-28 10:51"",""content"":""개고기햄버거ㅋㅋ"",""recomm"":""4"",""unrecomm"":""0""},{""nick"":""cop0****"",""date"":""2024-07-09 14:25"",""content"":"""",""recomm"":""0"",""unrecomm"":""0""}]"
"뉴시스","2024-03-29","AI 교과서 도입 코앞…울산교육청, 교사 디지털 기반 수업 지원","울산시교육청은 2025년 인공지능(AI) 디지털 교과서 도입을 앞두고 교사들의 디지털 기반 수업 혁신 역량 강화를 지원한다고 29일 밝혔다. 울산시교육청은 2025년 3월 인공지능 디지털 교과서가 도입되기 전 교원들이 교육 정보 기술 도구를 자유롭게 사용하고 정보를 공유할 수 있도록 교원 학술연구지원비로...","https://www.newsis.com/view/?id=NISX20240329_0002680028&cID=10814&pID=10800","https://n.news.naver.com/mnews/article/003/0012459456?sid=102","구미현 기자","2024-03-29 15:34:14","2024-03-29 15:35:05","학술연구지원비 1인당 60만 원 지원 [서울=뉴시스] 8일 교육부가 발표한 'AI 디지털교과서 추진 방안'에 따르면 학생의 학습 이력을 기록하고 진단하는 '인공지능(AI) 디지털교과서'를 오는 2028년 초등학교 3학년 이상 국어, 수학, 영어, 사회, 과학 등 대부분 교과목에 도입한다. (그래픽=전진우 기자) 618tue@newsis.com [울산=뉴시스]구미현 기자 = 울산시교육청은 2025년 인공지능(AI) 디지털 교과서 도입을 앞두고 교사들의 디지털 기반 수업 혁신 역량 강화를 지원한다고 29일 밝혔다. 울산시교육청은 2025년 3월 인공지능 디지털 교과서가 도입되기 전 교원들이 교육 정보 기술 도구를 자유롭게 사용하고 정보를 공유할 수 있도록 교원 학술연구지원비로 1인당 60만원을 지원할 예정이다. 선정 교사들은 스마트기기, 전자칠판 등을 활용해 다양한 교육 정보 기술 도구를 수업, 학급 경영, 평가 등에 적용하고, 수업 나눔과 사례 공유 등으로 교육 정보 기술을 활용한 문화를 만들어 나갈 예정이다. 이와 관련 시교육청은 28~29일 울산과학관 빅뱅홀에서 교원 교육 정보 기술(에듀테크) 도구 활용 지원 선정 교사 295명을 대상으로 설명회를 열었다. 28일은 초등 교사, 29일은 중등·특수·각종학교 교사를 대상으로 설명회를 진행했다. 이번 설명회에서 농소초 김덕우 교사와 언양중 윤수민 교사가 강사로 각각 나서 교육 정보 기술 도구 활용 지원 계획, 정산·결과보고서 작성 방법 등을 안내했다. 교육 정보 기술 활용 사례도 공유했다. 울산시교육청 관계자는 “교사들의 교육 정보 기술 활용 경험 기회를 늘려 디지털 기반 수업 혁신 역량을 갖춘 교원을 양성하도록 지원을 아끼지 않겠다”라고 말했다.","사회",0,"[]"
"연합뉴스","2024-03-27","AI교과서 도입 코앞인데…""디지털기기 보수 어렵고 과몰입 우려""","'AI디지털 교과서 도입'이라고 답한 교사는 2.5%에 그쳤다. 학교의 디지털 기반 교육혁신을 가로막는 가장 큰 장애물로는 74.3%의 교사가 디지털 기기 유지·보수·관리의 어려움을 지적했다. 교사노조는 ""교사들은 세심하고 장기적인 로드맵 없이 일방적으로 추진된 정책들이 현장에 얼마나 많은 업무와...","https://www.yna.co.kr/view/AKR20240327151700530?input=1195m","https://n.news.naver.com/mnews/article/001/0014592958?sid=102","고유선 기자","2024-03-27 17:25:10","2024-03-27 17:26:11","AI디지털 교과서 도입 발표하는 이주호 부총리 겸 교육부 장관 [연합뉴스 자료사진] (서울=연합뉴스) 고유선 기자 = 인공지능(AI) 디지털 교과서 도입이 한 해 앞으로 다가왔지만, 교사 상당수는 디지털 기반 교육을 하기에는 기기 유지·보수가 어렵고 학생들이 기기에 과몰입할 우려가 있다고 느끼는 것으로 나타났다. 교사노동조합연맹은 3월 18~24일 전국 유·초·중등·특수교육 교사 813명을 대상으로 '디지털 기반 교육에 대한 교사 인식'을 설문조사한 결과 이같이 나타났다고 27일 밝혔다. 디지털 기반 교육과 관련해 교사들은 ▲ 교육의 내용·방식의 변화와 혁신(46.7%) ▲ 학생에 대한 객관적 진단 제공(39.9%) ▲ 학생의 학습주도권 및 능동적 학습 역량 성장(30.8%)이 기대된다고 밝혔다. 이에 비해 ▲ 디지털 기기 과몰입·과의존(86.3%) ▲ 교육예산 편중으로 인한 공교육의 질 저하(45.1%) ▲ 수집된 디지털 정보 관리 문제(31.5%)를 우려하는 이들도 많았다. 특히 유치원에서 AI 기반 교육을 실시할 때 예상되는 가장 큰 문제로는 '유아의 발달단계와 학습원리에 부적합'(51.7%)', '유아기 디지털기기 의존도 강화·중독'(34.5%) 등을 지적하는 목소리가 높았다. 정부의 디지털 기반 교육 정책에 대해서는 교사 의견이 잘 반영되지 않고 있으며 장기적인 로드맵이 보이지 않는다는 지적이 나왔다. '디지털 기반 교육을 위한 사업이 순차적(계획·개발·안내·적용)으로 이뤄지는가'와 '장기적인 로드맵이 제시되고 있는가'에 대해 각 81.0%와 82.4%가 부정적인 입장을 표했고, '정책 수립·운영에 교사의 의견이 반영되고 있는가'에 대해서도 부정적인 답변이 87.0%였다. '교사 연수가 적절히 제공되고 있는가'에 대해서는 그나마 부정적 답변 비율이 69.0%로 다른 질문에 비해 낮았다. 디지털 기반 교육을 위해 정부가 가장 먼저 해야 할 일로는 52.3%가 무선망 구축 등 '디지털 인프라 확충'을 꼽았다. 'AI디지털 교과서 도입'이라고 답한 교사는 2.5%에 그쳤다. 학교의 디지털 기반 교육혁신을 가로막는 가장 큰 장애물로는 74.3%의 교사가 디지털 기기 유지·보수·관리의 어려움을 지적했다. 교사노조는 ""교사들은 세심하고 장기적인 로드맵 없이 일방적으로 추진된 정책들이 현장에 얼마나 많은 업무와 책임을 부여하고 혼란을 가중시켰는지 잘 알고 있다""며 ""교육부가 '수단'과 '목적'을 혼동하는 잘못을 범하지 않아야 한다""라고 지적했다. cindy@yna.co.kr","사회",0,"[]"
"서울경제","2024-03-27","‘AI교과서’ 시대 앞둔 교사들 “학생들 디지털 과몰입 우려돼…”","","https://www.sedaily.com/NewsView/2D6SSZN1OJ","https://n.news.naver.com/mnews/article/011/0004319583?sid=102","김수호 기자","2024-03-27 18:00:06","2024-03-27 18:00:06","'디지털 기반 교육에 대한 교사 인식' 설문 사진=이미지투데이 [서울경제] 인공지능(AI) 디지털 교과서 도입이 한 해 앞으로 다가온 가운데, 교사 상당수가 디지털 기반 교육과 관련해 부정적 인식을 가지고 있는 것으로 나타났다. 교사노동조합연맹이 전국 유·초·중등·특수교육 교사를 대상으로 '디지털 기반 교육에 대한 교사 인식'을 설문조사한 결과 이같이 나타났다고 27일 밝혔다. 현장 교사들은 디지털 기반 교육에 기대되는 점으로 △교육의 내용 및 방식의 변화와 혁신(46.7%) △학생에 대한 객관적 진단 및 피드백 제공(39.9%) 등을 꼽았다. 이에 비해 우려되는 점으로는 △디지털 기기 과몰입·과의존(86.3%) △교육예산 편중으로 인한 공교육의 질 저하(45.1%) △수집된 디지털 정보 관리 문제(31.5%)라고 응답했다. 특히 유치원에서 AI 기반 교육을 실시할 때 예상되는 가장 큰 문제로 △유아의 발달단계와 학습원리에 부적합'(51.7%) △유아기 디지털기기 의존도 강화·중독(34.5%) 등을 지적하는 목소리가 높았다. 정부의 디지털 기반 교육 정책에 대해서는 교사 의견이 잘 반영되지 않고 있으며 장기적인 로드맵이 보이지 않는다는 지적이 나왔다. 교육부가 지난 2월 발표한 '디지털 기반 교육 혁신 방안’에 대해 '디지털 기반 교육을 위한 사업이 순차적(계획·개발·안내·적용)으로 이뤄지는가'와 '장기적인 로드맵이 제시되고 있는가'에 대해 각 81.0%와 82.4%가 부정적인 입장을 표했다. 학교의 디지털 기반 교육혁신을 가로막는 가장 큰 장애물로는 74.3%의 교사가 디지털 기기 유지·보수·관리의 어려움을 지적했다. 이에 디지털 기반 교육을 위해 정부가 가장 먼저 해야 할 일로는 52.3%가 '디지털 인프라 확충'을 꼽았다. 'AI디지털 교과서 도입'이라고 답한 교사는 2.5%에 그쳤다. 교사노조는 ""교사들은 세심하고 장기적인 로드맵 없이 일방적으로 추진된 정책들이 현장에 얼마나 많은 업무와 책임을 부여하고 혼란을 가중시켰는지 잘 알고 있다""며 “디지털 기반 교육이 정말로 학생들의 학습에 도움이 되는지부터 재고해보아야 한다”고 제언했다.","사회",1,"[{""nick"":""euns****"",""date"":""2024-03-27 23:12"",""content"":""AI시대입니다. 아무리 AI가 발달한다고 하더라도 그 주체는 반드시 인간이어야 합니다. 인간을 완성하는 것은 어른으로 성장해야 하겠지만 올바른 어른으로 성장하기 위해서는 AI교과서로 배우는 학생시절보다 책과 놀이를 통해 감수성을 길러야 한다고 생각합니다. 선생님들이 걱정하는 것은 이해가 갑니다. 인간이 인간답게 성장하기 위해서는 종이책이 학생들의 손에 들려있어야 합니다. 책을 읽는 두 눈인 빛날 것입니다."",""recomm"":""0"",""unrecomm"":""0""}]"
"데일리안","2024-03-27","'AI교과서' 시대 앞둔 교사들 ""학생들 디지털 과몰입 우려""","","https://www.dailian.co.kr/news/view/1344346/?sc=Naver","https://n.news.naver.com/mnews/article/119/0002814165?sid=102","이태준 기자 (you1st@dailian.co.kr)","2024-03-27 18:36:03","2024-03-27 18:36:03","교사노동조합연맹, 전국 유·초·중등·특수교육 교사 813명 상대로 설문 응답자 46.7% ""교육 내용·방식의 변화와 혁신 기대된다"" 45.1% ""교육예산 편중으로 인한 공교육의 질 저하 우려"" 의견도 이주호 사회부총리겸 교육부장관이 18일 고양 원흥초에서 교원 학부모 등과 함께 이야기를 나누고 있다.ⓒ경기도교육청 제공 [데일리안 = 이태준 기자] 인공지능(AI) 디지털 교과서 도입이 한 해 앞으로 다가왔지만, 교사 상당수는 디지털 기반 교육을 하기에는 기기 유지·보수가 어렵고 학생들이 기기에 과몰입할 우려가 있다고 느끼는 것으로 나타났다. 교사노동조합연맹은 3월 18~24일 전국 유·초·중등·특수교육 교사 813명을 대상으로 '디지털 기반 교육에 대한 교사 인식'을 설문조사한 결과 이같이 나타났다고 27일 밝혔다. 디지털 기반 교육과 관련해 교사들은 ▲ 교육의 내용·방식의 변화와 혁신(46.7%) ▲ 학생에 대한 객관적 진단 제공(39.9%) ▲ 학생의 학습주도권 및 능동적 학습 역량 성장(30.8%)이 기대된다고 밝혔다. 이에 비해 ▲ 디지털 기기 과몰입·과의존(86.3%) ▲ 교육예산 편중으로 인한 공교육의 질 저하(45.1%) ▲ 수집된 디지털 정보 관리 문제(31.5%)를 우려하는 이들도 많았다. 특히 유치원에서 AI 기반 교육을 실시할 때 예상되는 가장 큰 문제로는 '유아의 발달단계와 학습원리에 부적합'(51.7%)', '유아기 디지털기기 의존도 강화·중독'(34.5%) 등을 지적하는 목소리가 높았다. 정부의 디지털 기반 교육 정책에 대해서는 교사 의견이 잘 반영되지 않고 있으며 장기적인 로드맵이 보이지 않는다는 지적이 나왔다. '디지털 기반 교육을 위한 사업이 순차적(계획·개발·안내·적용)으로 이뤄지는가'와 '장기적인 로드맵이 제시되고 있는가'에 대해 각 81.0%와 82.4%가 부정적인 입장을 표했고, '정책 수립·운영에 교사의 의견이 반영되고 있는가'에 대해서도 부정적인 답변이 87.0%였다. '교사 연수가 적절히 제공되고 있는가'에 대해서는 그나마 부정적 답변 비율이 69.0%로 다른 질문에 비해 낮았다. 디지털 기반 교육을 위해 정부가 가장 먼저 해야 할 일로는 52.3%가 무선망 구축 등 '디지털 인프라 확충'을 꼽았다. 'AI디지털 교과서 도입'이라고 답한 교사는 2.5%에 그쳤다. 학교의 디지털 기반 교육혁신을 가로막는 가장 큰 장애물로는 74.3%의 교사가 디지털 기기 유지·보수·관리의 어려움을 지적했다. 교사노조는 ""교사들은 세심하고 장기적인 로드맵 없이 일방적으로 추진된 정책들이 현장에 얼마나 많은 업무와 책임을 부여하고 혼란을 가중시켰는지 잘 알고 있다""며 ""교육부가 '수단'과 '목적'을 혼동하는 잘못을 범하지 않아야 한다""라고 지적했다.","사회",0,"[]"
