"press","date","title","summary","pressUrl","naverUrl","journalist","createdDate","updatedDate","body","category","commentCount","comments"
"뉴시스","2024-03-10","교육부, 내년 도입 AI 교과서에 EBS 문제·영상물 지원","교육부는 오는 11일부터 AI 디지털 교과서 개발사에 한국교육방송공사(EBS)가 개발한 동영상 1300여편과 수학·영어 평가 문항 9만7000개를 보급한다고 10일 밝혔다. 한국과학창의재단도 그래프·도형을 그려주는 수학 교육용 소프트웨어(SW) '알지오매스'를 AI 디지털 교과서에서 활용할 수 있도록 지원할...","http://www.newsis.com/view/?id=NISX20240308_0002654314&cID=10205&pID=10200","https://n.news.naver.com/mnews/article/003/0012416975?sid=102","김정현 기자","2024-03-10 09:00:00","2024-03-10 09:01:31","AI 디지털 교과서, 내년 3월 본격 도입 예정 한국과학창의재단도 '알지오매스' 연계 지원 [서울=뉴시스] 2023 에듀테크 코리아 페어가 열린 지난해 9월21일 서울 강남구 코엑스에 마련된 교육부 부스에서 디지털 기반 수업이 진행되고 있다. (사진=뉴시스DB). photo@newsis.com [세종=뉴시스]김정현 기자 = 내년부터 초·중·고에서 쓰일 인공지능(AI) 디지털 교과서에 EBS 개념 이해 동영상과 수학·영어 문제가 탑재된다. 교육부는 오는 11일부터 AI 디지털 교과서 개발사에 한국교육방송공사(EBS)가 개발한 동영상 1300여편과 수학·영어 평가 문항 9만7000개를 보급한다고 10일 밝혔다. 한국과학창의재단도 그래프·도형을 그려주는 수학 교육용 소프트웨어(SW) '알지오매스'를 AI 디지털 교과서에서 활용할 수 있도록 지원할 계획이다. AI 교과서는 기존의 서책형이나 PDF 교과서와 달리 이용하는 학생의 적성, 이해, 흥미, 실력을 내장된 AI 프로그램이 분석한다. 이를 통해 학생 한 명 한 명을 위한 맞춤형 교육이 가능하다고 교육부는 보고 있다. 교육부는 향후에도 AI 디지털 교과서에 접목할 수 있는 다양한 교육 콘텐츠를 지원한다는 방침이다. 기존 서책 교과서에선 영상이나 문제, SW 등 새로운 교육 콘텐츠를 접목하는 데 한계가 있었지만, AI 교과서에선 프로그램이 다양한 콘텐츠를 추천할 수 있기 때문이다. 교육부는 내년 3월에 초등학교 3~4학년, 중학교 1학년, 그리고 고등학교 1학년이 주로 듣는 공통과목 수학·영어·정보 교과에 AI 교과서를 도입할 계획이다. 특수교육 국어 교과에도 같은 시기 AI 교과서가 생긴다. 내년 도입되는 AI 교과서는 현재 개발 단계로, 오는 8월까지 마무리할 계획이다. 이어 오는 11월까지 당국의 검정 심사를 통과한 교과서가 학교에 도입된다. 오석환 교육부 차관은 ""AI 교과서는 '교사가 이끄는 교실 혁명'을 지원하기 위한 핵심적인 수단""이라며 ""앞으로도 질 높은 교육 콘텐츠를 제공하는 등 AI 교과서 개발 지원을 확대해 나가겠다""고 밝혔다.","사회",0,"[]"
"뉴스1","2024-03-10","교육부, AI 디지털교과서 콘텐츠 제작 지원 위해 EBS와 협력","지난해 6월 교육부는 'AI 디지털교과서 추진방안'을 통해 2025년 수학, 영어, 정보, 국어(특수교육) 교과에 AI 디지털교과서를 우선 도입한다고 발표한 바 있다. 교육부는 AI 디지털교과서가 성공적으로 개발될 수 있도록 개발사 자체 개발 콘텐츠 외에도 다양한 교육콘텐츠를 담을 수 있도록 지원한다는...","https://www.news1.kr/articles/5344611","https://n.news.naver.com/mnews/article/421/0007400702?sid=102","이유진 기자","2024-03-10 09:00:00","2024-03-10 09:01:19","한국과학창의재단 알지오매스와도 연계 예정 오석환 교육부 차관이 23일 경기도교육청을 방문, 늘봄학교 운영계획 및 준비사항 등을 점검하고 있다. (교육부 제공) 2024.2.23/뉴스1 (서울=뉴스1) 이유진 기자 = 교육부가 양질의 인공지능(AI) 디지털교과서 제작을 지원하기 위해 한국교육방송공사(EBS)와 손을 잡는다. 교육부는 오는 11일부터 EBS와 함께 교육콘텐츠를 개발사에 제공한다고 10일 밝혔다. 지난해 6월 교육부는 'AI 디지털교과서 추진방안'을 통해 2025년 수학, 영어, 정보, 국어(특수교육) 교과에 AI 디지털교과서를 우선 도입한다고 발표한 바 있다. 교육부는 AI 디지털교과서가 성공적으로 개발될 수 있도록 개발사 자체 개발 콘텐츠 외에도 다양한 교육콘텐츠를 담을 수 있도록 지원한다는 방침이다. 이를 위해 EBS가 보유한 개념 이해 동영상 1300여 편과 평가문항 9만7000개 등을 개발사에 제공한다. 아울러 향후 한국과학창의재단의 알지오매스(디지털 수학용 공학도구) 연계 등을 통해 교육콘텐츠 지원을 강화할 계획이다. 교육부는 ""AI 디지털교과서로 학생은 학습 수준‧속도에 맞는 콘텐츠로 배우게 되어 학습에 자신감을 가지고, 교사는 학생 맞춤교육을 실현할 수 있을 것으로 기대된다""고 전했다. 오석환 교육부 차관은 “AI 디지털교과서는 교사가 이끄는 교실혁명을 지원하기 위한 핵심적인 수단""이라며 ""앞으로도 질 높은 교육콘텐츠 제공하는 등 AI 디지털교과서 개발 지원을 확대해 나가겠다""고 말했다.","사회",1,"[{""nick"":""gina****"",""date"":""2024-03-10 12:24"",""content"":""디지털교과서 반대합니다. 학부모 수요조사도 없이 교육부 마음대로 결정하는 건 아니죠. 학교에서의 공부 만큼은 종이책으로 공부했으면 합니다."",""recomm"":""1"",""unrecomm"":""0""}]"
"머니투데이","2024-03-10","교육부-EBS, AI 디지털교과서 개발사에 교육 콘텐츠 제공","앞서 교육부는 내년 수학, 영어, 정보, 국어(특수교육) 교과에 AI 디지털교과서를 우선 도입한다고 발표한 바 있다. 기존의 서책 교과서는 특성상 교육콘텐츠를 제공하는데 한계가 있으나 AI 디지털교과서는 학생의 적성, 흥미, 이해 등을 분석해 적합한 교육콘텐츠를 추천하기 때문에 학생 맞춤교육이...","http://news.mt.co.kr/mtview.php?no=2024031009571968054","https://n.news.naver.com/mnews/article/008/0005009656?sid=102","유효송 기자 (valid.song@mt.co.kr)","2024-03-10 10:52:49","2024-03-10 10:53:07","정부세종청사 교육부 전경 교육부와 한국교육방송공사(EBS)는 내일(11일)부터 인공지능(AI) 디지털교과서 제작을 위해 개념 이해 EBS 보유 동영상 1300여편과 평가문항 9만7000개 등 관련 교육콘텐츠를 개발사에 제공한다고 10일 밝혔다. 앞으로 한국과학창의재단의 알지오매스(디지털 수학용 공학도구) 연계 등을 통해 교육콘텐츠 지원을 강화할 계획이다. 앞서 교육부는 내년 수학, 영어, 정보, 국어(특수교육) 교과에 AI 디지털교과서를 우선 도입한다고 발표한 바 있다. 기존의 서책 교과서는 특성상 교육콘텐츠를 제공하는데 한계가 있으나 AI 디지털교과서는 학생의 적성, 흥미, 이해 등을 분석해 적합한 교육콘텐츠를 추천하기 때문에 학생 맞춤교육이 가능하다는 설명이다. 이에 교육부는 디지털교과서가 성공적으로 개발될 수 있도록 'AI 디지털교과서 개발 지침'을 지난해 8월 개발사에 안내하고, 유관기관을 통해 기술지원을 제공해왔다. 이번에는 AI 디지털교과서에 개발사 자체 개발 콘텐츠 외에도 다양한 교육콘텐츠를 담을 수 있도록 지원한다는 것이다. 오석환 교육부 차관은 ""AI 디지털교과서는 교사가 이끄는 교실혁명을 지원하기 위한 핵심적인 수단으로 다양한 교육콘텐츠 지원이 중요하다""며 ""앞으로 질 높은 교육콘텐츠 제공하는 AI 디지털교과서 개발 지원도 확대해 나가겠다""고 말했다.","사회",0,"[]"
"한국일보","2024-03-10","내년 사용할 AI 디지털교과서에 EBS 설명·문제 실린다","교육부와 EBS는 양질의 AI 디지털교과서가 만들어질 수 있도록 교과서 개발사에 EBS의 교육 콘텐츠를 제공한다고 10일 밝혔다. AI 디지털교과서는 내년에 초등학교 3·4학년, 중·고등학교 1학년 수학·영어·정보·국어(특수교육) 교과에 우선 도입되고 이후 단계적으로 확대된다. 내년에 사용하는 AI...","https://www.hankookilbo.com/News/Read/A2024031011200005436?did=NA","https://n.news.naver.com/mnews/article/469/0000789646?sid=102","홍인택 기자","2024-03-10 14:40:03","2024-03-10 14:40:03","영상 1300개·평가문항 9만7000개 개발사 제공 2022년 9월 서울 강남구 코엑스에서 열린 '2022 에듀테크 코리아 페어'에 디지털교과서가 전시돼 있다. 연합뉴스 2025년부터 학생들이 사용할 인공지능(AI) 디지털교과서에 EBS가 제작한 개념 이해 동영상과 문제가 실린다. 교육부와 EBS는 양질의 AI 디지털교과서가 만들어질 수 있도록 교과서 개발사에 EBS의 교육 콘텐츠를 제공한다고 10일 밝혔다. AI 디지털교과서는 내년에 초등학교 3·4학년, 중·고등학교 1학년 수학·영어·정보·국어(특수교육) 교과에 우선 도입되고 이후 단계적으로 확대된다. 내년에 사용하는 AI 디지털교과서는 오는 8월까지 개발되고, 이후 11월까지 검정 심사를 받을 예정이다. 교과서 개발사에 제공하는 것은 EBS가 보유한 개념 이해 동영상 1,369편과 수학·영어 평가문항 9만7,000개다. 과목별로는 수학 7만3,000개, 영어 2만4,000개다. 평가문항은 AI 디지털교과서에 적용 가능한 형태로 재가공해 제공한다. 이에 따라 학생은 궁금한 개념을 EBS 영상을 통해 공부하고, 이후 EBS가 만든 평가문항을 풀면서 본인의 학습 수준을 확인할 수 있다. 교육부는 ""기존 서책 교과서는 교육콘텐츠를 제공하는 데 한계가 있으나 AI 디지털교과서는 학생의 적성, 흥미, 이해 등을 분석해 적합한 콘텐츠를 추천하기 때문에 맞춤형 교육이 가능하다""고 밝혔다.","사회",1,"[{""nick"":""cali****"",""date"":""2024-03-11 00:47"",""content"":""아이들은 이미 디지털에 중독되어 있는데 학교에서만큼은 종이책으로 가르치면 안될까?"",""recomm"":""0"",""unrecomm"":""0""}]"
"한국경제","2024-03-10","EBS 교육 콘텐츠 활용…AI 디지털교과서 개발","교육부는 내년 수학, 영어, 정보, 국어(특수교육) 교과에 우선 AI 디지털교과서를 도입할 예정이다. 각 개발사가 AI 디지털교과서를 개발 중이다. 이번에 제공되는 콘텐츠는 EBS가 보유한 개념 이해 동영상 1300여 편과 평가 문항 9만7000개 등이다. 각 개발사가 자체 개발한 콘텐츠뿐 아니라 다양한 교육...","https://www.hankyung.com/article/2024031098521","https://n.news.naver.com/mnews/article/015/0004958058?sid=102","강영연 기자","2024-03-10 18:36:01","2024-03-11 00:23:01","교육부와 한국교육방송공사(EBS)는 11일부터 인공지능(AI) 디지털교과서 제작을 위한 교육 콘텐츠를 개발회사에 제공한다고 10일 밝혔다. 교육부는 내년 수학, 영어, 정보, 국어(특수교육) 교과에 우선 AI 디지털교과서를 도입할 예정이다. 각 개발사가 AI 디지털교과서를 개발 중이다. 이번에 제공되는 콘텐츠는 EBS가 보유한 개념 이해 동영상 1300여 편과 평가 문항 9만7000개 등이다. 각 개발사가 자체 개발한 콘텐츠뿐 아니라 다양한 교육 콘텐츠를 AI 디지털교과서에 적용할 전망이다. 오석환 교육부 차관은 “질 높은 교육 콘텐츠를 제공하는 등 AI 디지털교과서 개발 지원을 확대해 나가겠다”고 밝혔다.","사회",0,"[]"
"전자신문","2024-03-10","교육부-EBS, AI 디지털교과서 개발사에 교육 콘텐츠 제공","교육부는 내년 수학, 영어, 정보, 국어 교과에 AI 디지털교과서를 도입할 예정이다. 이번에 제공되는 콘텐츠는 EBS가 보유한 개념 이해 동영상 1300여편과 평가 문항 9만7000개 등이다. 또한 앞으로 한국과학창의재단의 디지털 수학용 공학도구 '알지오매스' 연계 등을 통해 콘텐츠 지원을 강화할 계획이다....","https://www.etnews.com/20240310000032","https://n.news.naver.com/mnews/article/030/0003187679?sid=101","최다현 기자","2024-03-10 11:11:01","2024-03-10 11:11:01","교육부와 한국교육방송공사(EBS)는 인공지능(AI) 디지털교과서가 만들어질 수 있도록 교육콘텐츠를 개발사에 제공한다고 10일 밝혔. 교육부는 내년 수학, 영어, 정보, 국어 교과에 AI 디지털교과서를 도입할 예정이다. 이번에 제공되는 콘텐츠는 EBS가 보유한 개념 이해 동영상 1300여편과 평가 문항 9만7000개 등이다. 또한 앞으로 한국과학창의재단의 디지털 수학용 공학도구 '알지오매스' 연계 등을 통해 콘텐츠 지원을 강화할 계획이다. 오석환 교육부 차광는 “AI 디지털교과서는 교사가 이끄는 교실 혁명을 지원할 핵심 수단”이라며 “맞춤교육을 위해서는 다양한 교육 콘텐츠 지원이 중요하므로 앞으로도 질 높은 콘텐츠를 제공하는 등 AI 디지털교과서 지원을 확대해 나가겠다”고 밝혔다.","경제",0,"[]"
"노컷뉴스","2024-03-10","교육부, EBS와 협력해 인공지능 디지털 교과서 개발 지원","AI 디지털교과서는 오는 8월까지 개발이 이뤄지고, 이어 8월부터 11월까지 검정 심사를 거친 뒤 내년 3월부터 활용된다. 교육부는 EBS가 보유한 개념 이해 동영상 1300여 편과 평가문항 9만 7천개(수학 7만 3천개, 영어 2만 4천개) 등을 개발사에 제공한다. 이는 개발사의 자체 개발 콘텐츠 외에도 다양한...","https://www.nocutnews.co.kr/news/6108292","https://n.news.naver.com/mnews/article/079/0003871999?sid=102","박종환 기자","2024-03-10 09:02:01","2024-03-10 09:02:01","연합뉴스 교육부는 ""EBS와 협력해 양질의 인공지능(AI) 디지털교과서가 만들어질 수 있도록 11일부터 교육콘텐츠를 개발사에 제공한다""고 10일 밝혔다. 교육부가 지난해 6월 발표한 디지털교과서 추진방안에 따르면, 2025년에 초중고(초등 3~4학년, 중 1학년, 고 1학년) 수학, 영어, 정보, 국어(특수교육) 등 4개 교과에 AI 기술을 적용한 디지털 교과서가 우선 도입된다. AI 디지털교과서는 오는 8월까지 개발이 이뤄지고, 이어 8월부터 11월까지 검정 심사를 거친 뒤 내년 3월부터 활용된다. 교육부는 EBS가 보유한 개념 이해 동영상 1300여 편과 평가문항 9만 7천개(수학 7만 3천개, 영어 2만 4천개) 등을 개발사에 제공한다. 이는 개발사의 자체 개발 콘텐츠 외에도 다양한 교육콘텐츠를 담을 수 있도록 하기 위해서다. 교육부는 한국과학창의재단의 알지오매스(디지털 수학용 공학도구) 연계 등을 통해 교육콘텐츠 지원을 강화할 계획이다. 교육부는 지난해 8월 'AI 디지털교과서 개발 지침'을 개발사에 안내하고, 한국교육과정평가원(영어 검정심사), 한국과학창의재단(수학·정보 검정심사), 한국교육학술정보원(기술문서 안내), 한국정보통신기술협회(보안인증 컨설팅) 등 유관기관을 통해 기술지원을 제공해 왔다. ※CBS노컷뉴스는 여러분의 제보로 함께 세상을 바꿉니다. 각종 비리와 부당대우, 사건사고와 미담 등 모든 얘깃거리를 알려주세요. 이메일 : jebo@cbs.co.kr 카카오톡 : @노컷뉴스 사이트 : https://url.kr/b71afn","사회",0,"[]"
"중앙일보","2024-03-28","보아오포럼, ""전기 쓰듯 AI 활용하는 날 올 것""","그는 AI 분야의 교과서로 불리는 '인공지능: 현대적 접근방식'의 공동 저자이기도 하다. 2022년 말 챗GPT가 전 세계를 강타하자 세계 거대 테크 기업과... 장 원장은 AI에 대해 낙관적 견해를 전하면서도 산업의 발전과 더불어 거버넌스가 마련돼야 한다고 강조했다. AI 붐은 중국 디지털 경제 발전을 이끌고 경제...","https://www.joongang.co.kr/article/25238644","https://n.news.naver.com/mnews/article/025/0003350537?sid=104","","2024-03-28 15:22:29","2024-03-28 15:24:03","'2024 보아오(博鰲)포럼 연차총회'에서 27일 '인공지능 생성 콘텐트(AIGC)가 바꾼 세상' 분과포럼이 진행됐다. 신화통신 '2024 보아오(博鰲)포럼 연차총회' 인공지능(AI) 관련 분과포럼에서 참석자들은 AI의 발전에 대해 낙관적인 전망을 내놓으면서도 업계 감독을 강화해야 한다고 촉구했다. 스튜어트 러셀 캘리포니아대학교 버클리(UC 버클리) 전기공학·컴퓨터과학 교수는 GPT-4와 같은 거대언어모델(LLM)의 성능이 매우 인상적이라고 말했다. 러셀 교수는 ""필요할 때마다 전기를 사용하는 것처럼 수시로 지능에 접근할 수 있는 세상에서 사는 것이 어떤 것인지 미리 체험해볼 수 있다""고 덧붙였다. 그는 AI 분야의 교과서로 불리는 '인공지능: 현대적 접근방식'의 공동 저자이기도 하다. 2022년 말 챗GPT가 전 세계를 강타하자 세계 거대 테크 기업과 스타트업은 거대언어모델에 기반한 산업용 애플리케이션뿐만 아니라 유사한 AI 챗봇을 출시하며 서둘러 AI 경쟁에 합류하고 있다. AI 열풍은 인공지능 생성 콘텐트(AIGC)를 통해 사람들의 일상과 업무를 변화시킬 수 있을 것이라는 기대감을 불러일으켰다. 하지만 미래에 AI가 인간에게 위협이 될 수 있다는 두려움도 함께 찾아왔다. 장야친(張亞勤) 중국공정원원사, 칭화대학 석좌교수, 칭화대학 스마트산업연구원 원장이 27일 분과포럼에서 발언하고 있다. 신화통신 장야친(張亞勤) 칭화대학 스마트산업연구원 원장은 AI는 텍스트, 이미지, 동영상뿐만 아니라 수많은 다른 콘텐트도 생성할 수 있다고 말했다. 그는 ""변화에 대한 좋은 소식도 있지만 현재 우리가 직면한 위험에 대한 우려도 존재한다""고 부연했다. 장 원장은 AI에 대해 낙관적 견해를 전하면서도 산업의 발전과 더불어 거버넌스가 마련돼야 한다고 강조했다. AI 붐은 중국 디지털 경제 발전을 이끌고 경제 지형을 재편하고 있다. 중국 AI 및 지능형 언어 선도기업 커다쉰페이(科大訊飛∙iFLYTEK)의 류충(劉聰) 부사장은 거대언어모델을 선보인 데 이어 교육·의료 등 특정 산업을 위한 여러 애플리케이션을 출시했다고 밝혔다. 그는 ""'AI+'는 새로운 질적 생산력을 개발할 수 있는 좋은 기회가 될 것""이라고 말했다. 그러면서 개방형 혁신 플랫폼을 통해 37만 명의 거대모델 개발자를 끌어 모았다고 전했다. 멍푸(孟樸) 퀄컴 차이나 회장은 AI와 관련해 국가 거버넌스, 국제 협력, 보편적 사용을 위한 표준 설정 측면에서 세계와 업계의 협력을 촉구했다. 러셀 교수 역시 건전한 AI 경쟁을 당부했다. 그는 ""제로섬 게임으로 한 팀은 이기고 다른 팀은 질 것이라는 생각은 큰 실수""라고 말했다. 출처 신화통신 정리 차이나랩","세계",0,"[]"
"전자신문","2024-03-19","KT, 18일 경북도교육청에서 '지니버스'활용 도로명 주소 디지털 교과서 현장 교육 진행","","https://www.etnews.com/20240319000045","https://n.news.naver.com/mnews/article/030/0003190171?sid=102","정재훈 기자","2024-03-19 09:34:01","2024-03-19 09:34:01","KT가 행정안전부와 함께 AI 메타버스 '지니버스'를 활용한 도로명주소 교육용 디지털교과서를 개발하고 조기 확산을 위해 18일 대구경북 지자체 담당자들을 대상으로 특별 교육을 진행했다. 경상북도청 정보화교육장에서 대구경북 지자체 도로명주소 담당자들을 대상으로 진행된 이번 교육에서는 지니버스를 활용한 도로명주소 디지털교과서 개발 취지 및 교육 현장 활용 방안 등을 소개했다. 올 하반기 초등학교 현장 적용을 위한 취지다. KT가 행정안전부와 함께 AI 메타버스 '지니버스'를 활용한 도로명주소 교육용 디지털교과서를 개발하고 조기 확산을 위해 대구경북 지자체 담당자들을 대상으로 한 특별 교육을 진행했다 지니버스는 가상 세계에 나만의 공간을 꾸미고 생성형 AI로 아바타 메시지, 이미지를 생성할 수 있는 KT의 AI 메타버스 플랫폼이다. KT와 행안부는 여기에 도로명주소를 이해하고 체험할 수 있는 콘텐츠를 추가해 초등학생들을 위한 디지털교과서로 활용한다는 계획이다. 학생들은 지니버스를 통해 도로 유형별 도로 건설 및 건물 건축, 건물 유형별 번호판과 도로 방향용 도로 명판 제작·설치, 시설물에 설치된 사물 주소 확인 등을 수행하며 보다 능동적으로 도로명 주소 체계 전반을 이해할 수 있게 된다. 또 지니버스에 탑재된 AI NPC(Non Player Character)가 도로명주소 부여 원리 등의 일부 교육을 맡아 진행하며 교사들의 수업 준비 부담을 줄여주고, 각 주제 별 실시간 실습 과제 및 복습 퀴즈 등이 준비돼 있어 학생들의 이해도 및 수업 성취도 등을 실시간으로 파악할 수 있다. KT대구경북광역본부 관계자는 “급변하는 AX(AI Transformation) 전환시대를 맞아 학생들도 혁신적인 기술에 기반한 교육을 받을 수 있는 시대가 왔다. 앞으로도 지역사회에 최신 ICT기술을 전파하는데 앞장서겠다”고 말했다.","사회",0,"[]"
