"press","date","title","summary","pressUrl","naverUrl","journalist","createdDate","updatedDate","body","category","commentCount","comments"
"오마이뉴스","2024-03-15","사교육비 잡겠다더니... 사교육업체와 손잡은 교육부·교육방송","이주호 교육부장관은 지난해 AI 디지털교과서 사업계획을 발표하는 기자회견에서 'AI교과서 사업에 민간업체, 다시 말해 사교육업체와 함께 하겠다고 했는데, 사교육업체의 목표는 돈을 많이 버는 것이고, 공교육의 목표는 인간을 기르는 것인데, 목표가 상충되지 않느냐'는 물음에 다음과 같은 취지로...","https://www.ohmynews.com/NWS_Web/View/at_pg.aspx?CNTN_CD=A0003011056&CMPT_CD=P0010&utm_source=naver&utm_medium=newsearch&utm_campaign=naver_news","https://n.news.naver.com/mnews/article/047/0002426007?sid=102","교육언론창 윤근혁","2024-03-15 18:39:01","2024-03-15 18:39:01","[분석] AI교육 내세우며 업체 참여시킨 교육부... 업체와 제휴 맺은 EBS 논란 ▲ AI 디지털 교과서 개발 방식 설명하는 이주호 부총리 / 이주호 부총리 겸 교육부 장관이 지난해 6월 8일 오후 서울 종로구 정부서울청사에서 열린 AI(인공지능) 디지털 교과서 추진방안을 발표하고 있다. (연합뉴스) ⓒ 교육언론창 ""사교육비를 잡겠다""던 교육부와 교육방송(EBS)이 윤석열 정부 들어 사교육업체와 손을 잡고 공동사업을 벌이고 있다. 2년 연속 초중고 사교육비 상승 현황과 무관하지 않다는 지적이 나온다. 민간에듀테크와 협력? 알고 보니 사교육업체들 '수두룩' 15일, 교육언론[창]이 확인한 결과 교육부는 올해부터 본격화되는 AI(인공지능) 디지털교과서 제작 사업과 디지털 선도학교 사업 등 AI 디지털 교육혁신 사업을 벌이면서 민간에듀테크업체들을 참여시키고 있다. 그런데 이런 민간에듀테크 업체들의 상당수는 유료 온오프라인 사교육(과외) 사업을 벌이는 사교육업체이거나 사교육 관련 업체다. 교육부가 2025년 3월부터 영어·수학·정보·국어(특수) 교과부터 도입하는 AI교과서 사업의 경우 사교육사업과 학원 자본과 관련 있는 업체들이 이 교과서 개발·제작에 뛰어든 것으로 보인다. 교육부는 오는 8월 말부터 11월까지 개발사들이 만든 AI교과서에 대한 검정심사를 벌일 예정이다. ▲ 오석환 교육부차관이 19일 오후 에듀테크 신년하례회에 참석해 기념 사진을 찍고 있다. ©윤근혁 ⓒ 교육언론창 최근 교육부는 국회 교육위 강민정 더불어민주당 의원에게 보낸 답변서에서 ""AI교과서는 검·인정교과서 체제로 도입됨에 따라 별도 참여 기업 또는 단체를 제한하고 있지 않고 있다""고 밝혔다. 이런 방침에 따라 교육부는 AI교과서 개발 관련 설명회 등에 한국에듀테크산업협회(151개사), 디지털교육협회(102개사) 등의 업체에 모두 문을 열었다. 하지만 이 업체들의 상당수는 사교육업체이거나 사교육업체 관련 회사다. 현재 이들 회원사 가운데 수십 개가 AI교과서 제작에 뛰어든 상태로 보인다. 교육부 관계자는 교육언론[창]에 ""정확한 수치를 밝힐 수는 없지만, 두 자리 수의 관련 회원사들이 AI 교과서를 개발하고 있는 것으로 알고 있다""고 설명했다. 교육부는 ""기존 검정교과서도 사교육업체가 개발사인 곳도 있다""고 교육언론[창]에 밝혔다. 하지만 이들 업체들은 자신이 교과서 개발사라는 사실을 학부모 대상 사교육 광고에 활용하고 있다. AI교과서가 학교에 보급되고, AI 디지털 코스웨어(교육과정 소프트웨어)가 확대되면 이런 사교육업체의 광고전은 더 과열될 것으로 전망된다. AI교과서 만들 업체들, 선도학교에 들어온 업체들 ▲ '과외'업체임을 자처한 P수학이 최근 페이스북 등에 낸 광고물. ⓒ 교육언론창 교육부가 시·도교육청과 함께 지난해 351개 초·중·고를 지정하며 시작한 디지털 선도학교 사업에도 사교육업체들 프로그램이 활용되고 있다. 학교는 교육부 계획에 따라 이 선도학교 예산 가운데 상당 부분을 사교육업체(민간에듀테크) 프로그램을 사서 학생들에게 나눠주는 데 썼다. 올해 디지털 선도학교는 1000여 개로 늘어난다. 몇몇 디지털 선도학교에 자신의 학습프로그램을 제공했던 P수학은 최근 ""전국 15개 교육청과 함께 하는 P수학 (중략) 교육청 주관 우수 에듀테크 기업에서 만든 1등 수학코스웨어""라는 식의 광고를 해 논란이 되기도 했다. P수학은 자신의 사이트에서 '과외'업체를 자처하며 '고등학생 과외'의 경우 12개월 약정을 하면 월 21만4000원을 받는 사교육업체다. 이 업체의 해당 광고를 본 한 학부모는 교육언론[창]에 ""이것 학교 안에서 사용하는 것 아닌가? 광고를 봤는데 학교선생님들만 쓰는 (공공) 사이트인 줄 알았다. 깜빡 속았다""고 말하기도 했다. ""외국에서도 민간기업 참여한다""는 이주호, 실체는... 이주호 교육부장관은 지난해 AI 디지털교과서 사업계획을 발표하는 기자회견에서 'AI교과서 사업에 민간업체, 다시 말해 사교육업체와 함께 하겠다고 했는데, 사교육업체의 목표는 돈을 많이 버는 것이고, 공교육의 목표는 인간을 기르는 것인데, 목표가 상충되지 않느냐'는 물음에 다음과 같은 취지로 답변한 바 있다. ""영국 등 디지털 에듀테크 사업에 먼저 뛰어든 선진국들도 민간에듀테크 기업들을 참여시키고 있다. 이것은 세계의 추세다. 디지털 교육혁신을 위해 피할 수 없는 일이다."" 이런 답변에 대해 공적 연구기관에서 일하는 한 AI 디지털교육 전문가는 교육언론[창]에 ""미국과 영국 등 외국의 경우 민간업체가 정부와 공동사업을 벌이는 것은 맞다""면서도 ""하지만 이런 업체들은 마이크로소프트, 구글처럼 교육발전과 사회 환원 차원에서 참여한 것이지, 우리나라처럼 직접 사교육업체를 운영하는 회사가 참여한 게 아니다""라고 설명했다. 사교육업체 사업 번창하면 EBS도 이익? ▲ A 사교육업체 사이트. ⓒ 교육언론창 '사교육업체와 손잡기'를 하는 곳은 '사교육 경감' 등의 목적으로 한국교육방송공사법에 따라 방송을 송출하는 EBS도 마찬가지다. EBS는 지난해 8월 사교육업체인 A사와 제휴를 맺고 올해부터 사업을 본격 진행하고 있다. ""국어, 영어, 수학, 한국사능력검정시험 과목의 EBS 특화 교재 콘텐츠와 A사의 에듀테크를 결합해 중등 학습 콘텐츠를 제공""하기로 하고 손을 잡은 것이다. A사는 이주호 장관이 아시아교육협회 이사장을 맡을 때 이곳에 후원금을 내 유착 의혹을 받았던 업체다. 현재 A사는 EBS 대표 캐릭터인 펭수를 등장시켜 광고전에 활용하고 있다. 또한 'EBS 특별관'을 만들어 중학생들을 교육시키고 있다. A사는 중학생의 경우 12월 약정기준으로 월 15만2000원에서 16만4000원을 받는 유료 인터넷과외 사업을 벌이고 있다. A사의 사교육이 번창할수록 EBS 재정에도 도움이 될 것으로 보인다. 사교육걱정없는세상 ""교육부가 사교육식 교육확산 정책, 우려된다"" 사교육걱정없는세상의 신소영 공동대표는 교육언론[창]에 ""정부가 사교육의 근본적 유발 원인인 입시 경쟁구조 개혁에는 나서지 않은 채 민관협력이라는 미명 하에 사교육식 교육을 확산시키는 정책 기조를 갖고 있는 것은 우려스러운 일""이라면서 ""결국 학생·학부모·교사 모두에게 그러한 사교육식 교수-학습이 바람직하고 효과적이라는 인식을 퍼트리는 것 아니겠느냐""고 걱정했다. 그러면서 신 공동대표는 ""수업 이후 학생들이 자가 복습을 위해 부분 활용할 수 있는 정도의 (사교육업체 등이 제작한) AI코스웨어를 마치 혁신적 학습 솔루션인양 오인하도록 홍보하는 교육부의 AI교육 정책 추진방식이 문제""라고 강조했다. 덧붙이는 글 | 이 기사는 교육전문언론 교육언론[창](www.educhang.co.kr)에서 제공한 것입니다.","사회",13,"[{""nick"":""jski****"",""date"":""2024-03-15 20:15"",""content"":""그냥 가마니 있어라 그게 도와주는거다 무식한 인간들아"",""recomm"":""8"",""unrecomm"":""0""},{""nick"":""0300****"",""date"":""2024-03-16 08:54"",""content"":"""",""recomm"":""0"",""unrecomm"":""0""},{""nick"":""kore****"",""date"":""2024-03-15 19:50"",""content"":""이놈의 정권은 맞는게 어떻게 1도 없냐."",""recomm"":""10"",""unrecomm"":""1""},{""nick"":""ksb_****"",""date"":""2024-03-15 19:58"",""content"":""우리나라 산업망함.의대가려고 휴학계내는 명문대생들. 누가 사교육을 자초하나.우리나라는 초일류의 반도체산업으로 우리나라위상을 세계에알림. 문재앙이 이재요회장을 5년등안 감옥에들락날락 대만에tsmc빼앗기고 윤정부는 의대쏠림으로 이공계산업을 망하게함. 대통령복없다."",""recomm"":""1"",""unrecomm"":""6""},{""nick"":""pica****"",""date"":""2024-03-15 20:00"",""content"":""무능이 하늘을 찌르는구나.. 왜구 친일파 나라가 돼버렸네..."",""recomm"":""2"",""unrecomm"":""0""},{""nick"":""thad****"",""date"":""2025-01-17 19:37"",""content"":""EBS도 좌파가 다 먹음... 방송사들이 아주 다들 민노총 눈치보느라 정신 없네..."",""recomm"":""0"",""unrecomm"":""0""},{""nick"":""i481****"",""date"":""2024-04-03 13:20"",""content"":""국내 에듀테크는 빛좋은 개살구.결국 사기업만 돈 벌고 가난한 집 아이들과 부모들에게는 불안만 가중시킴. 실제 해보면 별것없음. 미국처럼 개별 맞춤형으로 분석하고 처방하고 코칭해주는 게 아니라 학습 흥미 유발하는 게임이나 오답유사 문제 제공, 숙제 진도 자동 체크가 대부분임. 차라리 에듀테크 전용 공기업을 설치해서 컴공이나 교육공학 석,박사 인재양성부터 채용까지 체계적으로 지원하길. 정부에서 재임기간 실적내기 바빠서 구체화된 장기적 계획이 없음."",""recomm"":""0"",""unrecomm"":""0""},{""nick"":""evas****"",""date"":""2024-03-17 12:03"",""content"":""ㅋㅋ석열이는 무슨 말을 하던, 어떤 행동을 하던 다 망조가 들었어ㅋㅋ1년 넘게 한것도 없지만 그나마 부하들이 한것도 다 망했네ㅋㅋ말과 행동이 반대ㅋㅋ언행일치가 그렇게 안되니?ㅋㅋ"",""recomm"":""0"",""unrecomm"":""0""},{""nick"":""anti****"",""date"":""2024-03-16 18:06"",""content"":""적을 알고 나를 알아야 위태롭지 않다 그건가? 사교육업체를 손을 봐야 할 놈들이 사교육업체와 손을 잡았다... 도둑놈들에게 곳간 열쇠 맡기고는 곳간 잘 지키라고 하는 꼴이지...나라 꼬라지 잘 돌아간다..."",""recomm"":""0"",""unrecomm"":""0""},{""nick"":""cerb****"",""date"":""2024-03-16 00:25"",""content"":"""",""recomm"":""0"",""unrecomm"":""0""},{""nick"":""ocea****"",""date"":""2024-03-15 21:32"",""content"":""정책은 사교육업체와 함께 가고 있는 중"",""recomm"":""0"",""unrecomm"":""0""},{""nick"":""r174****"",""date"":""2024-03-15 20:59"",""content"":""도둑놈 손에 보물 맡기는 꼴이네..."",""recomm"":""0"",""unrecomm"":""0""},{""nick"":""vite****"",""date"":""2024-03-15 19:49"",""content"":""돈되는건 뭔든 가입시키고 민영화 시키고 누가 이익을 볼까..."",""recomm"":""0"",""unrecomm"":""1""}]"
"뉴시스","2024-03-18","전북교육청 '에듀테크 멘토링' 제도 운영…교원 역량 강화","구체적으로는 ▲스마트기기 활용 수업 ▲스마트기기 활용 학급 운영 방법 ▲AI 디지털교과서 활용 수업 역량 강화 연수 ▲에듀테크 활용 수업 공개 등을 통해 멘토 교원이 가진 역량을 멘티 교원에게 전달한다. 올해는 디지털 기반 교육혁신 시범교육청 운영에 따라 도내 초·중·고 163개교의 교원 1442명이...","http://www.newsis.com/view/?id=NISX20240318_0002664478&cID=10808&pID=10800","https://n.news.naver.com/mnews/article/003/0012432852?sid=102","윤난슬 기자","2024-03-18 11:02:51","2024-03-18 11:03:13","올해 총 163개교, 교원 1442명 참여 [전주=뉴시스]윤난슬 기자 = 전북특별자치도교육청.(뉴시스DB) [전주=뉴시스] 윤난슬 기자 = 전북특별자치도교육청은 교원들의 에듀테크 역량 강화를 위해 오는 12월까지 '에듀테크 멘토링 제도'를 운영한다고 18일 밝혔다. 이 제도는 에듀테크 능력을 가진 교원(멘토)과 배움을 희망하는 교원(멘티)의 상호 나눔을 통해 멘티 교원의 역량을 향상하고 궁극적으로 학교 내 에듀테크 활용을 통한 수업 혁신의 분위기를 조성하는 데 목적이 있다. 멘토 교원이 멘티 교원 대상으로 월 1회 이상 에듀테크 관련 연수를 운영하는 방식이다. 구체적으로는 ▲스마트기기 활용 수업 ▲스마트기기 활용 학급 운영 방법 ▲AI 디지털교과서 활용 수업 역량 강화 연수 ▲에듀테크 활용 수업 공개 등을 통해 멘토 교원이 가진 역량을 멘티 교원에게 전달한다. 올해는 디지털 기반 교육혁신 시범교육청 운영에 따라 도내 초·중·고 163개교의 교원 1442명이 참여한다. 앞서 초·중학교 105개교 715명의 교원이 참여한 지난해의 2배 규모다. 이는 디지털 기반 교육혁신이라는 정책에 현장의 요구가 더해져 모든 학교급으로 확대된 것이다. 특히 도교육청은 내년 도입 예정인 AI 디지털 교과서와 관련된 연수를 필수과제로 운영해 새로운 교육 흐름에 선제 대응하고, 새로운 학교 문화를 선도한다는 계획이다. 지난해 멘티로 참여한 전주의 한 초등교사는 ""에듀테크 멘토링 제도를 통해 같은 학교 교사들이 에듀테크 활용에 대한 이야기를 나누며 자연스럽게 수업 나눔이 이뤄지고 있다""면서 ""에듀테크 활용 수업 역량이 향상되는 것뿐만 아니라 다양한 경력을 가진 선생님들과 공유하며 서로를 이해할 수 있어 올해도 신청했다""고 말했다. 민완성 미래교육과장은 ""올해는 오는 2025년 AI 디지털 교과서 도입에 대비해 학교 내 에듀테크 활용 수업 역량 확산에 주력할 것""이라면서 ""나눔에 앞장서는 멘토와 기꺼이 배우는 멘티들의 열정을 통해 학교 현장의 디지털 대전환에 적극적으로 대응하는 학교 문화를 조성해 나가겠다""고 말했다.","사회",0,"[]"
"연합뉴스","2024-03-28","과기정통부 ""국민·연구자 체감 11대 개혁과제 추진""","국민 체감 분야에서는 통신비, 인공지능(AI) 기반 건강관리, 폐쇄회로TV(CCTV) 등 안전 지킴 기술, 디지털 교과서, 반도체 칩 제작기회 제공 등이 선정됐다. 연구자 분야에서는 이공계 대학원생 연구생활장학금, 연구자 경력 통합지원, 혁신도전 연구개발(R&D), 국가 나노팹서비스, 연구자 지적재산(IP) 보상 강화...","https://www.yna.co.kr/view/AKR20240328087700017?input=1195m","https://n.news.naver.com/mnews/article/001/0014595392?sid=100","조승한 기자","2024-03-28 14:00:03","2024-03-28 14:01:24","이종호 장관, 개혁TF 3차 회의 주재 과학기술정보통신부 [과학기술정보통신부 제공] (서울=연합뉴스) 조승한 기자 = 과학기술정보통신부는 28일 국민 체감 5대 과제, 연구자 체감 5대 과제 등 11대 개혁과제를 발표하고 이를 추진해나가겠다고 밝혔다. 과기정통부는 이종호 장관이 이날 서울 종로구 국가과학기술자문회의 대회의실에서 개혁 태스크포스(TF) 3차 회의를 주재하고 개혁과제 세부 추진계획과 현장 소통 방안을 논의했다고 밝혔다. 개혁 TF는 윤석열 대통령 지시로 지난 1월 출범했으며 젊은 사무관, 청년보좌역 등으로 구성됐다. TF는 실무회의 등을 거쳐 국민과 연구자 체감도가 높고 부처 간 협업 필요성이 큰 과제를 발굴했다. 국민 체감 분야에서는 통신비, 인공지능(AI) 기반 건강관리, 폐쇄회로TV(CCTV) 등 안전 지킴 기술, 디지털 교과서, 반도체 칩 제작기회 제공 등이 선정됐다. 연구자 분야에서는 이공계 대학원생 연구생활장학금, 연구자 경력 통합지원, 혁신도전 연구개발(R&D), 국가 나노팹서비스, 연구자 지적재산(IP) 보상 강화 등이 선정됐다. 이외에 부처 협업과제로는 국방부와 미래전에 대비한 국방과학기술 협력이 꼽혔다. 이날 회의에서는 사무관들이 과제별 세부 추진방안을 발표하고 청년보좌역들이 과제에 대한 의견을 공유했다. 이 장관은 ""국민과 연구자가 확실히 성과를 체감하실 수 있도록 현장의 목소리를 들으며 속도감 있게 개혁과제를 추진해달라""며 ""개혁과제를 추진해 나가는 과정에서 국정 운영의 동반자이자 개혁을 이끌 적임자인 청년들과도 수시로 소통해 나가겠다""고 말했다. shjo@yna.co.kr","정치",0,"[]"
"KBS","2024-03-28","과기정통부 “국민·연구자 체감 11대 과제 추진”","","https://news.kbs.co.kr/news/pc/view/view.do?ncd=7925614&ref=A","https://n.news.naver.com/mnews/article/056/0011690613?sid=105","지형철 기자","2024-03-28 16:45:20","2024-03-28 16:50:01","과학기술정보통신부는 국민과 연구자가 체감할 수 있는 11대 개혁과제를 발표하고 이를 추진해나가겠다고 밝혔습니다. 이종호 과기정통부 장관은 오늘(28일) 서울 종로구 국가과학기술자문회의 대회의실에서 개혁 태스크포스(TF) 3차 회의를 주재하고 개혁과제 세부 추진계획과 현장 소통 방안을 논의했습니다. 개혁 TF는 윤석열 대통령 지시로 지난 1월 출범했으며, 저연차 사무관, 청년보좌역 등으로 구성됐습니다. TF는 실무회의 등을 거쳐 국민과 연구자 체감도가 높고 부처 간 협업 필요성이 큰 과제를 발굴했습니다. 국민 체감 분야에서는 통신비, 인공지능(AI) 기반 건강관리, 디지털 교과서 등이 선정됐습니다. 연구자 분야에서는 이공계 대학원생 연구생활장학금, 연구자 경력 통합지원, 혁신도전 연구개발(R&D), 연구자 지적재산(IP) 보상 강화 등이 선정됐습니다. 이외에 부처 협업과제로는 국방부와 미래전에 대비한 국방과학기술 협력이 꼽혔습니다. 이 장관은 “국민과 연구자가 확실히 성과를 체감하실 수 있도록 현장의 목소리를 들으며 속도감 있게 개혁과제를 추진해달라”고 당부했습니다. [사진 출처 : 연합뉴스 / 과학기술정보통신부 제공] ■ 제보하기 ▷ 전화 : 02-781-1234, 4444 ▷ 이메일 : kbs1234@kbs.co.kr ▷ 카카오톡 : 'KBS제보' 검색, 채널 추가 ▷ 네이버, 유튜브에서 KBS뉴스를 구독해주세요!","IT",0,"[]"
"매일경제","2024-03-14","프리윌린, ‘매쓰플랫x풀리수학 교사단’ 공식 출범","‘매쓰플랫 교사단’은 2025년 AI 디지털교과서 전면 도입을 앞두고, 교실의 디지털 전환을 선도할 에듀테크 및 AI 코스웨어 활용과 학습법에 관심이 있는 총 20명의 현직 초중고 교사가 최종 위촉됐다. 이들은 오는 8월까지 약 6개월간 AI 기술을 접목한 디지털 학습법을 교육 현장에 적극 전파하는 등 다양한...","https://www.mk.co.kr/article/10963864","https://n.news.naver.com/mnews/article/009/0005272003?sid=105","조광현 기자(cho.kwanghyun@mk.co.kr)","2024-03-14 08:41:01","2024-03-14 08:41:01","AI 기술/에듀테크 솔루션 활용 관심 있는 교사들로 구성된 ‘매쓰플랫x풀리수학 교사단’ 출범 현직 초중고 교사 20명 최종 위촉, 8월까지 에듀테크 솔루션 연수 및 체험, 전파 활동 진행 이미지=매쓰플랫x풀리수학 교사단 발대식 에듀테크 스타트업 프리윌린(대표 권기성)은 AI 기술 기반의 디지털 교실 전환에 관심이 있는 교사들로 구성된 ‘매쓰플랫x풀리수학 교사단’을 공식 출범하고, 비대면 발대식을 지난 7일 성료했다고 14일 밝혔다. ‘매쓰플랫 교사단’은 2025년 AI 디지털교과서 전면 도입을 앞두고, 교실의 디지털 전환을 선도할 에듀테크 및 AI 코스웨어 활용과 학습법에 관심이 있는 총 20명의 현직 초중고 교사가 최종 위촉됐다. 이들은 오는 8월까지 약 6개월간 AI 기술을 접목한 디지털 학습법을 교육 현장에 적극 전파하는 등 다양한 활동을 진행한다. 특히, 이들은 공교육 현장 경험을 바탕으로 AI 기술 기반 학습 솔루션인 매쓰플랫과 풀리수학을 직접 체험해 보고, 실제 교실에서 교사와 학생 모두에게 유용하게 활용될 다양한 개선 방향과 보완점 등을 제언하는 등 공교육 현장 중심의 자문을 진행하게 된다. 이에 더해 AI 기술에 대한 앞선 이해를 바탕으로 에듀테크 기반의 각종 학습 솔루션과 노하우를 온오프라인 채널을 통해 교실 현장에 적극 전파하는 역할도 수행한다. 활동 기간 동안 오프라인 에듀테크 연수 프로그램 연사로 참여하거나, 현직 교사들의 에듀테크 정보 교류 서비스인 ‘지식샘터’에서 온라인 강의를 진행한다. 또한, 매쓰플랫과 풀리수학의 학교 내 활용 사례를 전파하는 등 유용한 디지털 교육 콘텐츠를 전달하는 메신저 역할도 수행한다. 발대식에서는 매쓰플랫과 풀리수학 등 프리윌린의 AI 학습 솔루션 활용법에 대한 연수 프로그램이 진행됐다. 연수 프로그램 이후에는 AI 기술 도입으로 변화될 학교 교육의 환경과 패러다임 변화 등에 대해 열띤 토론이 진행됐다. 교사의 학습 코칭과 학업 성취도를 높일 학생 개별 맞춤형 수업 등 AI 기술 활용으로 교육의 질을 제고하고자 하는 교사들의 높은 관심을 방증했다. 프리윌린 권기성 대표는 “이제 학교 현장에도 AI 디지털교과서가 도입되는 시점에 학교 선생님들의 AI 시스템 적응을 돕고, 학생의 수업 능률과 선생님의 관리 효율을 함께 끌어올릴 수 있도록 현장에 계신 선생님들을 모시고 교사단을 출범하게 됐다.”라며, “이번 활동을 통해 매쓰플랫과 풀리수학 등 에듀테크의 솔루션이 선생님들의 업무를 경감시킬 ‘강력한 AI 보조 교사’임을 확인하고, 현장에 더 편리하게 적용, 활용하실 수 있는 계기가 되기를 기대한다.”라고 밝혔다. 한편, 프리윌린은 이번 교사단 활동을 시작으로, 앞으로도 학교 교육 현장에 에듀테크 기술을 알리는데 앞장선다는 계획이다. 특히, 교사의 코칭과 학생 자기주도학습을 모두 경험할 수 있는 프리윌린의 AI 코스웨어 솔루션(매쓰플랫과 풀리수학)을 직접 체험할 수 있는 단체 교사 연수단과 체험단 모집을 상반기 내에 추가로 진행할 예정이다. 이에 대한 자세한 정보는 추후 매쓰플랫, 풀리수학 홈페이지를 통해 공지될 예정이다.","IT",0,"[]"
