"press","date","title","summary","pressUrl","naverUrl","journalist","createdDate","updatedDate","body","category","commentCount","comments"
"이데일리","2024-03-04","도로명주소, 초등생에 AI 활용 디지털교과서로 교육한다","이번에 개발한 ‘도로명주소 디지털교과서’는 인공지능(AI)을 활용해 가상공간에 도로명주소·사물주소 등 주소 정보와 관련한 교육 내용을 초등생 눈높이에 맞춰 구성한 것이 특징이다. 학생은 가상공간에서 △도로 유형(대로, 로, 길)별 도로 건설 및 건물 건축 △건물 유형별 건물번호판과 도로 방향용...","http://www.edaily.co.kr/news/newspath.asp?newsid=02404246638820040","https://n.news.naver.com/mnews/article/018/0005684760?sid=100","이연호(dew9012@edaily.co.kr)","2024-03-04 12:01:21","2024-03-04 12:01:21","행안부, KT와 협업해 '도로명주소 디지털교과서' 교재 개발 상반기 시범 운영 거쳐 하반기부터 전국 초등학교에 보급 [이데일리 이연호 기자] 행정안전부는 초등생 교육용 ‘도로명주소 디지털교과서’ 교재 개발이 완료됨에 따라 설명회를 개최하고 시범 운영을 시작한다고 4일 밝혔다. 도로명주소 디지털교과서 주요 내용. 그래픽=행정안전부. 지난 2014년 도로명주소 전면 사용 이후, 초등 교과서에 도로명주소 교육이 포함됐으나 전문 교재가 없어 어린이들에게 체계적인 교육이 어렵다는 지적이 있었다. 이에 행정안전부는 지난해 5월부터 KT기술혁신부문(AI2X Lab)과 협업해 초등생을 위한 교재 개발을 진행해 왔다. 이번에 개발한 ‘도로명주소 디지털교과서’는 인공지능(AI)을 활용해 가상공간에 도로명주소·사물주소 등 주소 정보와 관련한 교육 내용을 초등생 눈높이에 맞춰 구성한 것이 특징이다. 학생은 가상공간에서 △도로 유형(대로, 로, 길)별 도로 건설 및 건물 건축 △건물 유형별 건물번호판과 도로 방향용 도로명판 제작·설치 △시설물에 설치된 사물주소 확인 등을 수행한다. 이를 통해 일상생활에서 사용하는 도로명주소의 사용 방법과 안전을 확보할 수 있는 방법 등을 익힐 수 있다. 교사를 위한 프로그램도 마련된다. 실습과제와 퀴즈를 통해 학생의 학습 이해도를 확인한 후, 이해도에 맞춰 학습보조 AI NPC(Non Player Character·컴퓨터가 조정하는 캐릭터)를 활용해 도로명주소의 부여 원리 등을 설명하는 기능을 첨부해 교육 부담을 덜 수 있도록 했다. 도로명주소 디지털교과서는 지난달 26일부터 나흘 간 스페인 바로셀로나에서 개최된 세계 최대 모바일 전시회 MWC(Mobile World Congress)를 통해 해외에도 공개됐다. 전시회에서 도로명주소 디지털교과서는 학습자가 직접 도시를 건설하면서 목표한 학습을 수행할 수 있다는 점과 AI를 활용한 수업 진행이 가능하다는 점 등이 참가자들의 많은 관심을 받았다. 행정안전부는 상반기 지자체 도로명주소 업무 담당자를 중심으로 하는 시범 운영을 통해 보완 사항 등을 점검하고 올해 하반기부터는 전국 초등학교로 확대 시행할 계획이다. 현장 교육이 시행되면 초등생들이 안전사고 등 긴급 상황 시 주소를 이용해 소방·경찰 등 긴급 기관에 정확한 위치 신고가 가능해질 것으로 기대된다. 이와 관련해 행정안전부는 지자체 도로명주소 업무 담당자를 대상으로 오는 5일부터 전국 6개 권역 설명회를 개최한다. 설명회는 5일 수도권을 시작으로 6일 강원권, 12일 호남권, 13일 충청권, 18일 영남권에서 진행된다. 시범 운영되는 ‘도로명주소 디지털교과서’는 KT에서 제공하는 ‘지니버스’를 통해서도 누구나 무료로 체험할 수 있다. 김민재 행정안전부 차관보는 “가상공간인 메타버스와 인공지능을 융합한 실습형 교육을 초등 교육에 제공해 교육 효과를 높이겠다”며 “주소를 기반으로 하는 생활 편의 논의가 활발히 진행되는 만큼 정부도 디지털 교육 환경 조성을 통해 어린이들이 주소를 쉽게 사용할 수 있도록 최선을 다하겠다”고 말했다.","정치",0,"[]"
"뉴시스","2024-03-04","행안부, 초등생 교육용 도로명주소 디지털교과서 개발","이번에 개발된 도로명주소 디지털교과서는 인공지능(AI)을 활용해 가상공간에 도로명주소·사물주소 등 주소정보와 관련된 내용을 초등학생 눈높이에 맞춰 구성한 것이 특징이다. 학생은 가상공간에서 도로 유형별로 도로를 건설하거나 건물을 건축하고, 건물 유형에 따라 건물 번호판과 도로 방향용...","http://www.newsis.com/view/?id=NISX20240304_0002646447&cID=10305&pID=10300","https://n.news.naver.com/mnews/article/003/0012404539?sid=100","성소의 기자","2024-03-04 12:00:00","2024-03-04 12:01:53","AI·가상공간 활용해 초등학생에 도로명주소 교육 상반기 시범운영 거쳐 하반기 전국 초교로 확대 [세종=뉴시스] 행정안전부가 KT기술혁신부문과 함께 개발한 도로명주소 디지털교과서 사용 예시. (자료=행정안전부). 2024.03.04. photo@newsis.com. *재판매 및 DB 금지 [세종=뉴시스]성소의 기자 = 행정안전부가 초등학생 교육용 '도로명주소 디지털교과서' 교재 개발을 완료해 시범운영을 시작한다고 4일 밝혔다. 지난 2014년부터 도로명주소가 전면 사용되면서 초등 교과서에 도로명주소 교육 내용이 포함됐지만, 전문교재가 제작된 적은 없었다. 이에 행안부는 지난해 5월부터 KT기술혁신부문과 협업해 초등학생을 위한 도로명주소 디지털교과서 개발을 진행해왔다. 이번에 개발된 도로명주소 디지털교과서는 인공지능(AI)을 활용해 가상공간에 도로명주소·사물주소 등 주소정보와 관련된 내용을 초등학생 눈높이에 맞춰 구성한 것이 특징이다. 학생은 가상공간에서 도로 유형별로 도로를 건설하거나 건물을 건축하고, 건물 유형에 따라 건물 번호판과 도로 방향용 도로명판을 제작해 설치하는 작업을 수행하게 된다. 또 시설물에 설치된 사물주소도 확인해 일상생활에서 사용하는 도로명주소의 사용방법 등을 익힐 수 있다. 도로명주소 디지털교과서는 지난달 26일부터 4일 간 스페인 바로셀로나에서 열린 세계 최대 모바일 전시회 MWC를 통해 해외에도 공개됐다. 행안부는 올해 상반기 지방자치단체 도로명주소 업무 담당자를 중심으로 하는 시범 운영을 실시해 보완사항을 점검하고 올해 하반기부터는 전국 초등학교로 확대 시행할 계획이다. 이와 관련해 행안부는 지자체 도로명주소 업무 담당자를 대상으로 오는 5일부터 전국 6개 권역 설명회를 개최한다. 설명회는 이달 5일 수도권을 시작으로 6일 강원권, 12일 호남권, 13일 충청권, 18일 영남권에서 진행된다. 시범 운영되는 도로명주소 디지털교과서는 KT에서 제공하는 지니버스를 통해서도 무료로 체험할 수 있다. 김민재 차관보는 ""주소를 기반으로 하는 생활 편의 논의가 활발히 진행되는 만큼 정부도 디지털 교육 환경 조성을 통해 어린이들이 주소를 쉽게 사용할 수 있도록 최선을 다하겠다""고 밝혔다.","정치",0,"[]"
"연합뉴스","2024-03-04","초등생 눈높이 맞는 '도로명주소 교과서' 발간…""AI 기술 활용""","인공지능(AI) 기술을 활용해 초등학생이 이해하기 쉽도록 도로명주소를 풀이한 '디지털 교과서'가 마련됐다. 행정안전부는 초등학생용 '도로명주소 디지털교과서' 개발이 완료됨에 따라 시범 운영을 시작한다고 4일 밝혔다. 2014년 도로명주소가 전면 사용된 후 초등교과서에도 관련 내용이 포함됐지만...","https://www.yna.co.kr/view/AKR20240304039300530?input=1195m","https://n.news.naver.com/mnews/article/001/0014540824?sid=100","이상서 기자","2024-03-04 12:00:09","2024-03-04 12:01:54","도로명주소 디지털교과서 예시 [행정안전부 제공] (서울=연합뉴스) 이상서 기자 = 인공지능(AI) 기술을 활용해 초등학생이 이해하기 쉽도록 도로명주소를 풀이한 '디지털 교과서'가 마련됐다. 행정안전부는 초등학생용 '도로명주소 디지털교과서' 개발이 완료됨에 따라 시범 운영을 시작한다고 4일 밝혔다. 2014년 도로명주소가 전면 사용된 후 초등교과서에도 관련 내용이 포함됐지만, 전문교재가 마련되지 않은 탓에 어린이들에게 체계적인 교육이 어렵다는 지적이 있었다. 이에 행안부는 지난해 5월부터 KT기술혁신부문과 협업해 초등학생을 위한 교재 개발을 진행해왔다. 이번에 개발된 '도로명주소 디지털교과서'는 인공지능을 활용해 초등학생의 눈높이에 맞는 교육을 구성한 것이 특징이다. 학생들이 가상공간인 메타버스에서 도로명주소의 사용 방법과 안전 확보 방법 등을 익힐 수 있도록 했다. 교사들이 실습 과제와 퀴즈를 통해 학생의 이해도를 확인한 후, 습득 수준에 따라 보충 설명하는 시스템도 마련했다. 행안부는 시범 운영을 통해 보완사항을 점검하고, 하반기에 전국 초등학교로 확대 시행할 계획이다. 5일부터 전국 6개 권역을 돌면서 지자체 도로명주소 업무 담당자를 대상으로 한 설명회도 연다. '도로명주소 디지털교과서'는 KT의 '지니버스'에서도 누구나 무료로 체험할 수 있다. 김민재 행안부 차관보는 ""메타버스와 인공지능을 융합한 실습형 교육을 통해 학습 효과를 높이겠다""고 말했다. shlamazel@yna.co.kr","정치",0,"[]"
"TV조선","2024-03-04","초등생 위한 도로명 주소 교과서 발간…""인공지능(AI) 활용""","‘도로명주소 디지털교과서’는 인공지능(AI)을 활용해 가상 공간에 도로명주소 등 주소정보와 관련된 교육 내용을 초등생 눈높이에 맞춰 구성했다. 행안부는 올해 상반기까지 시범 운영을 통해 보완사항을 점검하고 하반기부터 전국 초등학교로 확대 시행할 계획이다.","https://news.tvchosun.com/site/data/html_dir/2024/03/04/2024030490087.html","https://n.news.naver.com/mnews/article/448/0000450080?sid=102","노도일 기자","2024-03-04 13:44:00","2024-03-04 13:46:08","행정안전부가 초등생을 위한 ‘도로명 주소 디지털교과서’를 개발해 시범 운영을 시작한다. 2014년 도로명주소 사용 이후 전문교재 없이 어린이들에게 체계적 교육이 어렵다는 지적이 잇따랐다. 이에 행안부는 지난해 5월부터 KT기술혁신부문(AI2X Lab)과 협업해 초등생을 위한 교재 개발을 진행했다. ‘도로명주소 디지털교과서’는 인공지능(AI)을 활용해 가상 공간에 도로명주소 등 주소정보와 관련된 교육 내용을 초등생 눈높이에 맞춰 구성했다. 행안부는 올해 상반기까지 시범 운영을 통해 보완사항을 점검하고 하반기부터 전국 초등학교로 확대 시행할 계획이다.","사회",0,"[]"
"이데일리","2024-03-12","교육부 교과서 채택일정 일방적 연기에 교과서 업계 ‘당황’","2025년부터 초·중·고교 18개 과목을 시작으로 2028년까지 총 96개 과목에 대해 AI 디지털교과서를 만들어야 한다. 교과서 개발업체는 이 일정 역시 빠듯해 ‘개발 일정을 맞추기 어렵다’는 볼멘소리가 나오고 있다. 소은주 교육부 책임교육정책관은 “출판사들이 수정 보완을 하도록 안내해주는 것”이라며...","http://www.edaily.co.kr/news/newspath.asp?newsid=01279206638822664","https://n.news.naver.com/mnews/article/018/0005689968?sid=101","김영환 기자","2024-03-12 06:16:01","2024-03-12 06:16:01","교육부가 3월 14일로 지정된 중고등 교과서 채택일을 일방 연기 채택일은 4월18일로 예정…'교과서 질 제고' 사유 출판사에 추가 자료 요구 없고 수정 기한은 그대로 [이데일리 김영환 기자] 교육부가 3월 중순으로 예고했던 교과서 채택 일정을 일방적으로 연기하자 교과서 개발업체들의 일정에 차질이 불가피해졌다. 교육부 세종청사 전경.(사진=이데일리DB) 12일 관련업계에 따르면 교육부는 오는 14일로 예정했던 ‘2022 개정 교육과정 초중고 검정 교과용 도서 채택 일정’(2025년 도입)을 내달 18일로 연기했다. 검정 교과용 도서는 정부가 출판사로부터 제출받은 교과용 도서에 대한 적합성 여부를 따진 뒤 교육부 장관의 검정을 받은 책이다. 검정을 받아야만 일선 학교 현장에서 활용될 수 있다. 교육부가 일정을 연기한 표면적인 이유는 ‘교과서 품질 제고’다. 선정에 신중을 기하겠다는 것이다. 다만 미뤄진 일정만큼 수정 제출 기한은 늘리지 않아 오히려 부정적인 영향을 미칠 전망이다. 수학과 과학 과목을 심사하는 한국과학창의재단은 5월까지, 나머지 과목을 담당하는 한국교육과정평가원은 6월까지 수정 제출일 기한을 정했는데 이는 조정되지 않았다. 수학 및 과학 검정 교과서를 제출한 출판사는 불과 한 달 남짓한 기간에 교과서를 수정해야 하는 셈이다. 일선 출판사는 내년부터 본격 도입이 계획된 인공지능(AI) 디지털교과서 개발에도 나서야 한다. 2025년부터 초·중·고교 18개 과목을 시작으로 2028년까지 총 96개 과목에 대해 AI 디지털교과서를 만들어야 한다. 교과서 개발업체는 이 일정 역시 빠듯해 ‘개발 일정을 맞추기 어렵다’는 볼멘소리가 나오고 있다. 소은주 교육부 책임교육정책관은 “출판사들이 수정 보완을 하도록 안내해주는 것”이라며 “충분한 사전검토기간을 확보하면 수정 검토 보완서 자체를 더 정확하게 전달할 수 있다”고 했다. 이어 “수정 보완할 수 있는 시간이 단축은 되지만 전체 발표는 8월 말에 최종 공고를 하게 될 것”이라고 말했다.","경제",0,"[]"
"전자신문","2024-03-05","[단독] 'AI교과서 학습데이터 플랫폼' LG CNS 우선협상대상자 선정","AI 디지털교과서로 학생별 맞춤 교육을 제공하기 위해서는 교과서를 통해 산출되는 개별 학생 학습데이터를 수집하고 분석해 활용해야 한다. 높은 수준의 민감한 학생 개인 정보가 모이는 만큼 높은 수준의 보안과 데이터 안정성 및 신뢰성이 요구된다. 또한 대기업 참여가 제한됐던 4세대...","https://www.etnews.com/20240305000247","https://n.news.naver.com/mnews/article/030/0003186465?sid=105","최다현 기자","2024-03-05 14:47:01","2024-03-05 14:47:01","ⓒ게티이미지뱅크 교육부가 추진 중인 '인공지능(AI) 디지털교과서 학습데이터 관리 체계 구축'사업 우선협상대상자로 LG CNS가 선정됐다. 공공소프트웨어 사업에 대기업 입찰 참여 제한 제도가 도입된 후 교육부가 실시하는 대규모 시스템 구축 사업에 대기업이 선정된 것은 처음이다. 5일 관련업계에 따르면 교육부는 조달청 입찰에서 AI 학습데이터 관리체계 구축 우선협상대상자로 선정된 LG CNS와 최종 계약을 위한 기술협상을 진행 중이다. 사업에는 LG CNS와 KT가 입찰에 참여했다. LG CNS는 가격점수에서는 KT보다 낮은 점수를 받았으나 기술점수에서 앞서면서 우선협상대상자로 선정된 것으로 확인됐다. 조달청에 따르면 LG CNS는 가격점수 9.9점으로 KT와 0.1점 차이가 있었으나 기술점수에서 90점을 받아 87점을 받은 KT를 앞섰다. 교육부는 학습데이터 관리체계 구축을 위해 807억원의 예산을 투입하며 대기업의 사업 참여 제한을 풀었다. 이는 학습데이터의 중요도를 고려한 조치로 풀이된다. AI 디지털교과서로 학생별 맞춤 교육을 제공하기 위해서는 교과서를 통해 산출되는 개별 학생 학습데이터를 수집하고 분석해 활용해야 한다. 높은 수준의 민감한 학생 개인 정보가 모이는 만큼 높은 수준의 보안과 데이터 안정성 및 신뢰성이 요구된다. 또한 대기업 참여가 제한됐던 4세대 교육행정정보시스템(NEIS)에서 오류가 발생해 교육부가 전담TF를 꾸려 대응해야 했던 점 등도 결정에 영향을 준 것으로 보인다. 교육부의 대규모 시스템 구축 사업에 대기업이 참여하는 것은 2010년 삼성SDS가 3세대 NEIS를 구축한 후 처음이다. 2013년 소프트웨어진흥법 제정으로 공공 소프트웨어 사업에 대기업 참여 제한이 도입되면서 교육부 사업은 대부분 중소·중견기업 컨소시엄이 맡아 왔다. 소프트웨어업계 관계자는 “LG CNS가 AI, 빅데이터 기술을 활용해 영어회화 학습 앱을 개발하는 등 교육 관련 디지털전환을 선도해온 점이 좋은 평가를 받은 것 같다”라고 말했다.","IT",13,"[{""nick"":""dlek****"",""date"":""2024-03-06 09:19"",""content"":""우리 아이들 미래 교육이 달린 문제인데 가격이 중요하겠습니까? 기술력과 책임감이 최고"",""recomm"":""4"",""unrecomm"":""1""},{""nick"":""901c****"",""date"":""2024-03-08 18:40"",""content"":"""",""recomm"":""0"",""unrecomm"":""0""},{""nick"":""hi_s****"",""date"":""2024-03-06 14:31"",""content"":""AI 야 독도는 어디 땅??"",""recomm"":""1"",""unrecomm"":""0""},{""nick"":""vick****"",""date"":""2024-03-06 16:51"",""content"":""유럽은 미성년 디지털시스템교육방식 부작용을 깨우치고 종이책 아나로그 방식으로 정신차러 가던데 ... 아무리 IT강국이라고 돈벌이도 좋지만 디지털중독의 부작용을 생각하면 아직 미성숙한 아이들 교육엔 적용하지는 말아야지"",""recomm"":""0"",""unrecomm"":""0""},{""nick"":""molc****"",""date"":""2024-03-06 15:02"",""content"":""WOW_CNS 멋진 메타 뻐스 에서 >>>>> 메타 X 로 성장하거라"",""recomm"":""0"",""unrecomm"":""0""},{""nick"":""hyej****"",""date"":""2024-03-06 13:57"",""content"":""어느 삼라만상에서 광물을 캐다 충돌시켜야 al공주님 열량체로 공급할까? 주식값오를텐데. 아직도 우주정거장이 종착역이라니.인간이 종속되기까지 좀더 남았나? 인간이 그때까지 할일 완벽한 설계도면 만들고 쉬는거지."",""recomm"":""0"",""unrecomm"":""0""},{""nick"":""acev****"",""date"":""2024-03-06 13:18"",""content"":""교육이 단순 스킬 전달로 되는게 아닌데,,,"",""recomm"":""0"",""unrecomm"":""0""},{""nick"":""doll****"",""date"":""2024-03-06 13:03"",""content"":""다단계 학습지 가입"",""recomm"":""0"",""unrecomm"":""0""},{""nick"":""doll****"",""date"":""2024-03-06 13:02"",""content"":"""",""recomm"":""0"",""unrecomm"":""0""},{""nick"":""hugh****"",""date"":""2024-03-06 12:42"",""content"":""과연 이 업체들이 AI를 알고는 있나? 교육 전문성은 또 어떻고? 그럴 바에는 차라리 해외 기업들에게도 문호를 열어라 괜히 또 디바이스 몇만대 사다 깔아주고 1년되면 못쓰는 쓰레기 만들지 말고 ㅠ"",""recomm"":""0"",""unrecomm"":""0""},{""nick"":""sych****"",""date"":""2024-03-06 12:44"",""content"":""대기업이 수주하고 개발은 누가할까요?외주를 받은 중소기업이 형편없는 단가로 개발합니다.대기업 매출만 올리는 일이지요"",""recomm"":""1"",""unrecomm"":""2""},{""nick"":""adh4****"",""date"":""2024-03-06 12:27"",""content"":""안그래도 힘든 공공IT 시장에 대기업까지 들어오면 중소기업들은 폭망이라고 봐야죠. 내수 경기가 좋지 않으면 나라에서 공공 사업을 일으켜야 하는데, 예산을 줄이고, 대기업 참여를 허용해 버리면 어쩌자는 건지. 대기업은 오히려 대규모 공공 인프라 사업쪽으로 가야함이 마땅한데..."",""recomm"":""0"",""unrecomm"":""1""},{""nick"":""eyel****"",""date"":""2024-03-06 09:25"",""content"":""쓸데업는데돈쓰네"",""recomm"":""2"",""unrecomm"":""5""}]"
"디지털데일리","2024-03-05","교육부, 800억원 규모 ‘AI교과서 활용체계’ 구축사업자로 LG CNS 선정","","https://www.ddaily.co.kr/page/view/2024030518001255110","https://n.news.naver.com/mnews/article/138/0002168197?sid=105","권하영 기자","2024-03-05 18:11:01","2024-03-05 18:11:01","[Ⓒ LG CNS] [디지털데일리 권하영기자] 교육부가 추진하는 ‘인공지능(AI) 디지털교과서 학습데이터 활용체계 구축’ 사업의 우선협상대상자로 LG CNS가 KT를 제치고 선정됐다. 5일 조달청에 따르면, 교육부는 한국교육학술정보원(KERIS)을 통해 발주한 ‘AI 디지털교과서 학습데이터 활용체계 구축’ 사업의 우선협상대상자로 LG CNS를 선정했다. 현재 최종계약을 위한 기술협상을 진행 중인 단계로 알려졌다. AI 디지털교과서 학습데이터 활용체계 구축 사업은 교육부가 오는 2025년부터 전국 초중고에 도입 예정인 ‘AI 디지털교과서’를 통해 산출되는 학습데이터의 수집·분석·활용 체계를 구축하는 것이 골자다. 총 807억8400만원 규모로 추진된다. 이 사업에는 KT와 LG CNS가 각각 컨소시엄을 구성해 입찰에 참여했다. LG CNS는 KT와 비교해 가격점수는 0.1점 낮았으나 기술점수에서 90점을 받아 87점을 받은 KT를 앞서면서 우선협상대상자가 된 것으로 확인된다. 교육부가 추진하는 대규모 정보시스템 구축 사업에 대기업이 참여한 것은 2010년 삼성SDS가 3세대 교육행정정보시스템 NEIS를 구축한 이후 처음인데, 2013년 소프트웨어진흥법상 대기업의 공공 소프트웨어(SW) 사업 참여제한 제도가 도입됐기 때문이다. 다만 이번 사업은 대기업 참여제한 예외대상으로 인정받은 사례다. 정부는 보안·기술상 이유로 대기업 참여 필요성이 인정되는 사업에 한해 과학기술정보통신부(이하 과기정통부) 심의를 거쳐 대기업 참여를 허용해주고 있다. 교육부는 민감한 학생 개인정보가 모이는 AI 디지털교과서 학습데이터의 중요도를 고려해 대기업 참여사업으로 이번 사업을 추진한 것으로 보인다. 이와 별개로, 과기정통부는 700억원 규모 이상의 대형 공공SW 사업에 대해서는 대기업 참여제한을 없애는 법 개정도 추진하고 있다.","IT",0,"[]"
"전자신문","2024-03-14","[에듀플러스]KERIS, 디지털배지 국제표준 기구 원에드테크 업무협약 체결","원에드테크는 AI 디지털 교과서 개발에 사용되고 있는 각종 국제표준을 보유해 향후 다양한 디지털 교육 분야에서 한국교육학술정보원과 상호 협력이 가능할 것으로 보고 있다. 장상현 교육데이터센터장은 “학습자의 학습결과 데이터를 발급하고 유통할 수 있는 국제적인 디지털 자격증명 생태계를...","https://www.etnews.com/20240314000112","https://n.news.naver.com/mnews/article/030/0003189051?sid=105","이지희 기자","2024-03-14 10:47:03","2024-03-14 10:47:03","(왼쪽부터) 롭 아벨 원에드테크 대표, 베아트리스 아르니야스 원에드테크 부사장 , 장상현 한국교육학술정보원 교육데이터 센터장. 사진=KERIS 한국교육학술정보원(KERIS)은 미국 비영리 디지털배지 국제표준 기구인 원에드테크(1EdTech)와 업무협약을 체결했다고 14일 밝혔다. 이번 협약은 지난 4일부터 6일까지 미국 뉴올리언즈에서 개최된 '2024 디지털 크리덴셜 서밋(2024 Digital Credentials Summit)' 기간 중 양 기관이 디지털배지 사업 및 다양한 에듀테크 활용에 적극적으로 협력하기로 하면서 성사됐다. 원에드테크는 AI 디지털 교과서 개발에 사용되고 있는 각종 국제표준을 보유해 향후 다양한 디지털 교육 분야에서 한국교육학술정보원과 상호 협력이 가능할 것으로 보고 있다. 장상현 교육데이터센터장은 “학습자의 학습결과 데이터를 발급하고 유통할 수 있는 국제적인 디지털 자격증명 생태계를 만들면 개인 역량과 기술에 대한 개별 맞춤 학습은 물론 국가 인재 양성 정책까지 지원할 기회가 제공될 것” 이라고 말했다. 한편, KERIS는 디지털 교육과 관련한 각종 국제 표준에 관해 연구해 왔다. 국내 디지털배지 사업을 활성화하기 위해 올해부터 교육부가 추진하는 국내 디지털배지 협의체를 운영한다. 원에드테크는 디지털배지 국제표준인 오픈배지 표준뿐 아니라 각종 디지털 교육 부문의 국제 표준을 주도하고 있다.","IT",0,"[]"
